{
  "$schema": "./schemas/capability-matrix.schema.json",
  "schemaVersion": "0.1",
  "project": "qxnm-forge",
  "author": {
    "name": "高宏顺",
    "email": "18272669457@163.com"
  },
  "updatedAt": "2026-07-21T16:06:03Z",
  "defaultStatus": "unsupported",
  "implementations": [
    "dotnet",
    "rust"
  ],
  "foundationFeatures": [
    "domain.portable",
    "protocol.stdio",
    "agent.loop",
    "agent.steering",
    "agent.follow_up",
    "session.journal",
    "session.get",
    "session.lifecycle",
    "session.linear_continuation",
    "session.cross_language",
    "session.cross_language_writer_lock",
    "session.branch",
    "session.compaction",
    "session.pi_v3_import",
    "tool.file_read",
    "tool.file_write",
    "tool.file_edit",
    "tool.search",
    "executor.process",
    "executor.shell",
    "executor.process_tree_unix",
    "executor.process_tree_windows",
    "terminal.open",
    "security.approval",
    "security.path_boundary",
    "security.hard_sandbox",
    "cli.text",
    "provider.sponsored_catalog",
    "provider.credential_store",
    "provider.custom_connection",
    "provider.sponsored_route",
    "agent.profile_crud",
    "agent.profile_run_binding",
    "storage.application_database",
    "ui.headless_contract"
  ],
  "apiFamilyScope": {
    "families": [
      "faux",
      "openai-completions",
      "mistral-conversations",
      "openai-responses",
      "azure-openai-responses",
      "openai-codex-responses",
      "anthropic-messages",
      "bedrock-converse-stream",
      "google-generative-ai",
      "google-vertex",
      "openrouter-images"
    ],
    "features": [
      "text",
      "streaming",
      "tools",
      "reasoning",
      "image_input",
      "image_output",
      "retry",
      "cancellation"
    ]
  },
  "providerScope": {
    "manifest": "providers.v1.json",
    "features": [
      "authentication",
      "text",
      "streaming",
      "tools",
      "reasoning",
      "image_input",
      "image_output",
      "live_smoke"
    ]
  },
  "claims": [
    {
      "implementation": "rust",
      "target": {
        "kind": "foundation",
        "id": "domain.portable"
      },
      "status": "implemented",
      "evidence": [
        "rust/src/domain.rs"
      ]
    },
    {
      "implementation": "rust",
      "target": {
        "kind": "foundation",
        "id": "protocol.stdio"
      },
      "status": "conformant",
      "evidence": [
        "rust/src/protocol.rs",
        "rust/src/daemon.rs",
        "CONFORMANCE/fixtures/golden/hello.trace.ndjson"
      ]
    },
    {
      "implementation": "rust",
      "target": {
        "kind": "foundation",
        "id": "agent.loop"
      },
      "status": "conformant",
      "evidence": [
        "rust/src/agent.rs",
        "CONFORMANCE/fixtures/golden/hello.trace.ndjson"
      ]
    },
    {
      "implementation": "rust",
      "target": {
        "kind": "foundation",
        "id": "agent.steering"
      },
      "status": "implemented",
      "evidence": [
        "rust/src/agent.rs",
        "rust/src/daemon.rs"
      ]
    },
    {
      "implementation": "rust",
      "target": {
        "kind": "foundation",
        "id": "agent.follow_up"
      },
      "status": "implemented",
      "evidence": [
        "rust/src/agent.rs",
        "rust/src/daemon.rs"
      ]
    },
    {
      "implementation": "rust",
      "target": {
        "kind": "foundation",
        "id": "session.journal"
      },
      "status": "conformant",
      "evidence": [
        "rust/src/session.rs",
        "CONFORMANCE/session_runner.py",
        "CONFORMANCE/session_tail_runner.py",
        "CONFORMANCE/fixtures/session/journal-tail-recovery-cases.json",
        "SPEC/adr/0020-session-journal-tail-recovery.md"
      ],
      "notes": "共同 portable Session 与 ADR 0020 runner 已验证崩溃恢复/续接、no-LF 尾部内容寻址备份与修复、完整 LF 损坏零修改、未知 extensions、event gap、exact-one 恢复及 clean reopen 幂等。本 claim 不覆盖 backup→truncate→diagnostic 中间点崩溃原子性、未实测平台 durability、migration 或 artifact repair。"
    },
    {
      "implementation": "rust",
      "target": {
        "kind": "foundation",
        "id": "session.get"
      },
      "status": "conformant",
      "evidence": [
        "rust/src/session.rs",
        "rust/src/daemon.rs",
        "CONFORMANCE/session_runner.py",
        "CONFORMANCE/fixtures/session/portable-v0.1/expectations.json"
      ]
    },
    {
      "implementation": "rust",
      "target": {
        "kind": "foundation",
        "id": "session.lifecycle"
      },
      "status": "conformant",
      "evidence": [
        "rust/src/session_lifecycle.rs",
        "rust/src/daemon.rs",
        "rust/tests/session_lifecycle_rpc.rs",
        "SPEC/adr/0030-session-lifecycle-application-service.md",
        "SPEC/schemas/session/lifecycle.schema.json",
        "CONFORMANCE/session_lifecycle_runner.py",
        "CONFORMANCE/tests/test_session_lifecycle_runner.py"
      ],
      "notes": "共同真实 daemon runner 已通过 16 cases、Rust→.NET 与 .NET→Rust 两个方向、两端 cursor 分页、archive/restore/delete、portable journal 与 archive-state 互操作及摘要/错误/输出脱敏。门禁固定使用 faux，清除真实 Provider credential/endpoint，并报告 providerHttpConfigured:false；writer lease 的本地 loopback witness 不属于 Provider HTTP。当前证据不覆盖真实 Provider、全部 socket syscall 观测、断电 durability、mutation 中间点崩溃注入、Windows reparse 实机或移动端远程存储。"
    },
    {
      "implementation": "rust",
      "target": {
        "kind": "foundation",
        "id": "session.linear_continuation"
      },
      "status": "conformant",
      "evidence": [
        "rust/src/agent.rs",
        "rust/src/provider/faux.rs",
        "CONFORMANCE/session_runner.py",
        "CONFORMANCE/fixtures/session/portable-v0.1/continuation.scenario.json"
      ]
    },
    {
      "implementation": "rust",
      "target": {
        "kind": "foundation",
        "id": "session.cross_language"
      },
      "status": "conformant",
      "evidence": [
        "rust/src/session.rs",
        "CONFORMANCE/session_runner.py",
        "docs/verification.md"
      ],
      "notes": "共同 runner 已通过 Rust→.NET→Python→TypeScript→Go 与反向五阶段 handoff；本 claim 仅覆盖 portable v0.1 linear Session，不覆盖 branch、compaction、migration 或 concurrent writer。"
    },
    {
      "implementation": "rust",
      "target": {
        "kind": "foundation",
        "id": "tool.file_read"
      },
      "status": "conformant",
      "evidence": [
        "rust/src/tools.rs",
        "CONFORMANCE/tool_runner.py",
        "CONFORMANCE/fixtures/tools/tool-approval-cases.json"
      ]
    },
    {
      "implementation": "rust",
      "target": {
        "kind": "foundation",
        "id": "tool.file_write"
      },
      "status": "conformant",
      "evidence": [
        "rust/src/tools.rs",
        "CONFORMANCE/tool_runner.py",
        "CONFORMANCE/fixtures/tools/tool-approval-cases.json"
      ]
    },
    {
      "implementation": "rust",
      "target": {
        "kind": "foundation",
        "id": "tool.file_edit"
      },
      "status": "implemented",
      "evidence": [
        "rust/src/tools.rs"
      ]
    },
    {
      "implementation": "rust",
      "target": {
        "kind": "foundation",
        "id": "tool.search"
      },
      "status": "implemented",
      "evidence": [
        "rust/src/tools.rs"
      ]
    },
    {
      "implementation": "rust",
      "target": {
        "kind": "foundation",
        "id": "executor.process"
      },
      "status": "conformant",
      "evidence": [
        "rust/src/executor.rs",
        "rust/src/tools.rs",
        "rust/src/agent.rs",
        "CONFORMANCE/executor_runner.py",
        "CONFORMANCE/fixtures/executor/executor-cases.json"
      ],
      "notes": "Linux 真实 daemon 已通过 argv、双流、bounded stdin、secret 环境隔离、timeout、output limit、非零退出和显式审批案例；Windows/macOS 证据不由本机结果外推。"
    },
    {
      "implementation": "rust",
      "target": {
        "kind": "foundation",
        "id": "executor.shell"
      },
      "status": "conformant",
      "evidence": [
        "rust/src/executor.rs",
        "rust/src/tools.rs",
        "CONFORMANCE/executor_runner.py"
      ],
      "notes": "Linux 真实 daemon 已通过显式 POSIX sh、分离双流与非零退出；Windows shell 仍待实机 Job Object 门禁。"
    },
    {
      "implementation": "rust",
      "target": {
        "kind": "foundation",
        "id": "executor.process_tree_unix"
      },
      "status": "implemented",
      "evidence": [
        "rust/src/executor.rs",
        "CONFORMANCE/executor_runner.py",
        "CONFORMANCE/fixtures/executor/executor_helper.py"
      ],
      "notes": "真实 daemon 已清理长期存活的 setsid delayed-write 回归后代；实现依赖毫秒级 `/proc` PPID/start-time 采样，无法封闭首次采样前快速 double-fork/reparent，wire 仅报告 unix_process_group，因此保持 implemented 且不外推到 macOS。"
    },
    {
      "implementation": "rust",
      "target": {
        "kind": "foundation",
        "id": "terminal.open"
      },
      "status": "implemented",
      "evidence": [
        "rust/src/terminal.rs",
        "rust/src/daemon.rs",
        "rust/src/executor.rs",
        "CONFORMANCE/executor_runner.py",
        "CONFORMANCE/fixtures/executor/executor-cases.json",
        "CONFORMANCE/fixtures/executor/executor_helper.py"
      ],
      "notes": "仅覆盖 Linux 且 QXNM_FORGE_CONFORMANCE=1 与 QXNM_FORGE_TERMINAL_CONFORMANCE_POLICY=fixture-only 双门控的测试专用策略：PTY master/slave 以原子 O_CLOEXEC 创建，解释器绑定 runner parent executable fd identity，helper 经文件身份与冻结 SHA-256 复核后复制到完整 sealing 的 memfd snapshot，并以 Python -I、空 environment 执行；只允许 disconnectPolicy=terminate 与 terminal/close mode=terminate。真实 daemon 已通过 pty_identity_io_resize_signal、attachment_replay_and_cleanup、input_backpressure_and_atomic_rejection 三个增强动态案例。当前证据不覆盖 retain/detach、owner disconnect、daemon SIGKILL、生产 policy、hard sandbox、macOS 或 Windows/ConPTY；/proc 采样也不是强 containment，因此仅为 implemented，不构成 conformant、live-verified 或公开支持。"
    },
    {
      "implementation": "rust",
      "target": {
        "kind": "foundation",
        "id": "security.approval"
      },
      "status": "conformant",
      "evidence": [